id	title	description	link	image_link	additional_image_link	availability	price	condition	brand	google_product_category	product_type	identifier_exists
76985	Jean RICA LEWIS Denim Clásico Lona Gruesa	¡Hola a todos los amantes del estilo clásico! Presentamos el increíble Pantalón de Jean Rica Lewis, un verdadero ícono de la moda. Este pantalón, con su corte clásico y confeccionado con lona gruesa de alta calidad, te brindará comodidad y durabilidad inigualables. Características destacadas: Marca: Rica Lewis Color: Denim (azul clásico) Corte: Clásico Material: Lona gruesa resistente Tallas disponibles: 38, 40, 42, 44, 46, 48, 50, 52, 54, 56, 58, 60 Ya no tenes que preocuparte por encontrar el talle perfecto, ya que ofrecemos una amplia gama de tallas que van desde el 38 hasta el 60. ¡En Pinillos encontrarás el pantalón perfecto que se ajuste a tu estilo y medida! Nuestro compromiso es brindarte la mejor experiencia de compra. Además, ofrecemos envío gratuito para que recibas tu pantalón directamente en la puerta de tu casa, sin complicaciones. No pierdas la oportunidad de lucir a la moda y sentirte cómodo al mismo tiempo. Este pantalón de jean Rica Lewis es ideal para cualquier ocasión, ya sea un evento casual o una salida con amigos. ¡Destaca tu estilo con este clásico atemporal! ¡Aprovecha esta oferta y llevate tu pantalón de Jean Rica Lewis ahora mismo! ¡No te quedes sin el tuyo!	https://www.pinillos.com.ar/Jean-rica-lewis-denim-clasico-lona-gruesa.html	https://plataforma.iduo.com.ar/Panelcontenidos/Contenidos/Jean-rica-lewis-denim-clasico-lona-gruesa-1718305542-0-0.webp	https://plataforma.iduo.com.ar/Panelcontenidos/Contenidos/Jean-rica-lewis-denim-clasico-lona-gruesa-1718305542-0-1.png,https://plataforma.iduo.com.ar/Panelcontenidos/Contenidos/Jean-rica-lewis-denim-clasico-lona-gruesa-1718305542-0-2.jpg	in_stock	60500.00 ARS	new	Rica Lewis	Apparel & Accessories > Clothing > Pants	Jeans	no
76987	Jean RICA LEWIS American Celeste Clàsico	¡Hola a todos los amantes del estilo clásico! Presentamos el increíble Pantalón de Jean Rica Lewis, un verdadero ícono de la moda. Este pantalón, con su corte clásico y confeccionado con lona de alta calidad, te brindará comodidad y durabilidad inigualables. Características destacadas: Marca: Rica Lewis Color: Celeste Corte: Clásico Material: Lona resistente Tallas disponibles: 38, 40, 42, 44, 46, 48, 50, 52, 54, 56, 58, 60 Ya no tenes que preocuparte por encontrar el talle perfecto, ya que ofrecemos una amplia gama de tallas que van desde el 38 hasta el 60. ¡En Pinillos encontrarás el pantalón perfecto que se ajuste a tu estilo y medida! Nuestro compromiso es brindarte la mejor experiencia de compra. No pierdas la oportunidad de lucir a la moda y sentirte cómodo al mismo tiempo. Este pantalón de jean Rica Lewis es ideal para cualquier ocasión, ya sea un evento casual o una salida con amigos. ¡Destaca tu estilo con este clásico atemporal! ¡Aprovecha esta oferta y llevate tu pantalón de Jean Rica Lewis ahora mismo! ¡No te quedes sin el tuyo!	https://www.pinillos.com.ar/Jean-rica-lewis-american-celeste-clasico.html	https://plataforma.iduo.com.ar/Panelcontenidos/Contenidos/Jean-rica-lewis-american-celeste-clasico-1718307204-0-0.webp	https://plataforma.iduo.com.ar/Panelcontenidos/Contenidos/Jean-rica-lewis-american-celeste-clasico-1718307204-0-1.png,https://plataforma.iduo.com.ar/Panelcontenidos/Contenidos/Jean-rica-lewis-american-celeste-clasico-1718307204-0-2.png,https://plataforma.iduo.com.ar/Panelcontenidos/Contenidos/Jean-rica-lewis-american-celeste-clasico-1718307204-0-3.jpg	in_stock	58080.00 ARS	new	Rica Lewis	Apparel & Accessories > Clothing > Pants	Jeans	no
76986	Jean RICA LEWIS Blue Black Clásico Lona Gruesa	Presentamos el increíble Pantalón de Jean Rica Lewis, un verdadero ícono de la moda. Este pantalón, con su corte clásico y confeccionado con lona gruesa de alta calidad, te brindará comodidad y durabilidad inigualables. Características destacadas: Marca: Rica Lewis Color: Blue Black (Azul Marino) Corte: Clásico Material: Lona gruesa resistente Tallas disponibles: 38, 40, 42, 44, 46, 48, 50, 52, 54, 56, 58, 60 Ya no tenes que preocuparte por encontrar el talle perfecto, ya que ofrecemos una amplia gama de tallas que van desde el 38 hasta el 60. ¡En Pinillos encontrarás el pantalón perfecto que se ajuste a tu estilo y medida! Nuestro compromiso es brindarte la mejor experiencia de compra. Además, ofrecemos envío gratuito para que recibas tu pantalón directamente en la puerta de tu casa, sin complicaciones. No pierdas la oportunidad de lucir a la moda y sentirte cómodo al mismo tiempo. Este pantalón de jean Rica Lewis es ideal para cualquier ocasión, ya sea un evento casual o una salida con amigos. ¡Destaca tu estilo con este clásico atemporal! ¡Aprovecha esta oferta y llevate tu pantalón de Jean Rica Lewis ahora mismo! ¡No te quedes sin el tuyo!	https://www.pinillos.com.ar/Jean-rica-lewis-blue-black-clasico-lona-gruesa.html	https://plataforma.iduo.com.ar/Panelcontenidos/Contenidos/Jean-rica-lewis-blue-black-clasico-lona-gruesa-1718306388-0-0.webp	https://plataforma.iduo.com.ar/Panelcontenidos/Contenidos/Jean-rica-lewis-blue-black-clasico-lona-gruesa-1718306388-0-1.webp,https://plataforma.iduo.com.ar/Panelcontenidos/Contenidos/Jean-rica-lewis-blue-black-clasico-lona-gruesa-1718306388-0-2.webp,https://plataforma.iduo.com.ar/Panelcontenidos/Contenidos/Jean-rica-lewis-blue-black-clasico-lona-gruesa-1718306388-0-3.jpg	in_stock	64130.00 ARS	new	Rica Lewis	Apparel & Accessories > Clothing > Pants	Jeans	no
72619	Zapato OMBU Ozono Marron punta Plastica	Zapato OMBU Seguridad Calzado Trabajo Cuero Ozono P/Plástica ______________________________________ NUEVA LÍNEA OMBÚ OZONO PLUS, MÁS LIVIANO, MÁS RESISTENTE, MAYOR COMODIDAD ______________________________________ La calidad de siempre ahora con: • Puntera de acero, con certificación IRAM. • Planta bidensidad más liviana, resistente y cómoda. • Guarda reflectiva de alta visibilidad. • Calzado dieléctrico en su totalidad. • Calzado de seguridad Certificado bajos normas IRAM ____________________________________ Capellada Color: Marrón Talles 37/38/39/40/41/42/43/44/45/46 Capellada exterior: Cuero flor seleccionado de alta calidad. Capellada interior: Forro interno con tecnología OMBU TECH ANTIMICROBIAL (Protección antimicótica) / Forro de talón en cuero. Cuello: Acolchado confort perimetral con goma espuma. Lengüeta: Acolchado confort de goma espuma. Forro interno con tecnología OMBU TECH ANTIMICROBIAL Puntera: De acero CERTIFICADA POR IRAM. Accesorios: Exclusiva tecnología OMBU TECH PLUCONF (+) La Plantilla Ultra Confortable es el resultado de estudios Ergonométricos y Antropométricos realizados por especialistas. Guarda reflectiva de alta visibilidad. Tipo de Cordones: Tejidos de materiales compuestos por fibras sintéticas de alta resistencia con herretes de blindaje plástico reforzado en las puntas. Pasa Cordones: Ganchos metálicos de máxima resistencia. Planta • Inyectada en PU Bidensidad Shock Absorber • Dieléctrica • Resistente a Hidrocarburos • Antideslizante • Autolimpiante • Resistente a la Flexión • Resistente a la Abrasión • Estrías para Escaleras • Traba de seguridad en zona de enfranque • Pisada Ancha • Calzado TRIDENSIDAD ___________________________ ¯¯¯¯¯¯¯¯¯¯¯¯¯¯¯¯¯¯¯¯¯¯¯¯¯¯¯¯¯¯¯¯¯¯¯¯¯¯¯¯¯¯¯¯¯ • Nos encontramos en Constitución, a metros de la estación de tren y subte. • Horario de atención: Lunes a Viernes 9 a 13 y 14 a 18 • Colectivos: 12, 28, 45, 46, 51, 53, 59, 84, 90, 96, 97, 98, 100, 102, 143, 168 • Subte: Linea C, Estación Constitución • Tren: Linea Roca, Estación Constitución • Emitimos Factura A y B • Envíos a todo el país ¯¯¯¯¯¯¯¯¯¯¯¯¯¯¯¯¯¯¯¯¯¯¯¯¯¯¯¯¯¯¯¯¯¯¯¯¯¯¯¯¯¯¯¯¯ ¡Estamos para lo que necesites no dudes en consultarnos!	https://www.pinillos.com.ar/Zapato-ombu-ozono-marron-punta-plastica.html	https://plataforma.iduo.com.ar/Panelcontenidos/Contenidos/Zapato-ozono-marron-p-plastica-1694544307-0-0.png		in_stock	111808.84 ARS	new	Ombu	Apparel & Accessories > Shoes	Zapatos	no
72614	526 Boxer Eyelit Alg/Lycra con elástico bordado	EYELIT Bóxer de algodón natural elastizado. De calce ajustado, su tejido suave y resistente se adapta confortablemente al cuerpo. Posee puño en piernas. Articulo: 526 Composición: 94% algodón, 6% elastano Talles: M a XXL (Guía de talles) 36/38 = S 40/42 = M 44/46 = L 48/50 = XL 52/54 = XXL ____________________________________ • Nos encontramos en Constitución , a metros de la estación de tren y subte. • Horario de atención: Lunes a Viernes 9 a 13 y 14 a 18 • Colectivos: 12, 28, 45, 46, 51, 53, 59, 84, 90, 96, 97, 98, 100, 102, 143, 168 • Subte: Linea C, Estación Constitución • Tren: Linea Roca, Estación Constitución • Emitimos Factura A y B • Envíos a todo el país ¯¯¯¯¯¯¯¯¯¯¯¯¯¯¯¯¯¯¯¯¯¯¯¯¯¯¯¯¯¯¯¯¯¯¯¯¯¯¯¯¯¯¯¯¯ ¡Estamos para lo que necesites no dudes en consultarnos!	https://www.pinillos.com.ar/526-boxer-eyelit-alglycra-con-elastico-bordado.html	https://plataforma.iduo.com.ar/Panelcontenidos/Contenidos/526-boxer-eyelit-alglycra-con-elastico-bordado-1694541997-0-0.webp	https://plataforma.iduo.com.ar/Panelcontenidos/Contenidos/526-boxer-eyelit-alglycra-con-elastico-bordado-1694541997-0-1.webp,https://plataforma.iduo.com.ar/Panelcontenidos/Contenidos/526-boxer-eyelit-alglycra-con-elastico-bordado-1694541997-0-2.webp	in_stock	21767.90 ARS	new	Eyelit	Apparel & Accessories > Clothing > Underwear & Socks > Underwear	Boxers	no
